{
  "schemaVersion": 1,
  "skillName": "simple-changes",
  "triggers": [
    {
      "id": "queue-put-this-up",
      "prompt": "Put this up as a focused change.",
      "expected": true
    },
    {
      "id": "queue-completed-work-ready",
      "prompt": "The implementation and checks are complete. Put this up.",
      "expected": true
    },
    {
      "id": "queue-versioned-ui-artifacts",
      "prompt": "Put these generated UI surface iterations up.",
      "expected": true
    },
    {
      "id": "sweep-everything-ready",
      "prompt": "Open focused changes for everything ready.",
      "expected": true
    },
    {
      "id": "integrate-ready",
      "prompt": "Merge what's ready and leave active work alone.",
      "expected": true
    },
    {
      "id": "ship-ready",
      "prompt": "Ship everything ready.",
      "expected": true
    },
    {
      "id": "ship-expedited",
      "prompt": "Ship this fast and finish the remaining release work afterward.",
      "expected": true
    },
    {
      "id": "ship-break-glass",
      "prompt": "Deploy first and have independent review happen after deployment.",
      "expected": true
    },
    {
      "id": "ship-tested-live-recommendation",
      "prompt": "This has been tested and needs to go live.",
      "expected": true
    },
    {
      "id": "sync-bare-command",
      "prompt": "sync",
      "expected": true
    },
    {
      "id": "sync-remote-main",
      "prompt": "Sync this repo with remote main.",
      "expected": true
    },
    {
      "id": "sync-inline-with-main",
      "prompt": "Get us inline with main.",
      "expected": true
    },
    {
      "id": "sync-pull-latest-origin",
      "prompt": "Pull the latest changes from origin.",
      "expected": true
    },
    {
      "id": "reconcile-repository",
      "prompt": "Clean this repository up without losing work.",
      "expected": true
    },
    {
      "id": "preview-plan",
      "prompt": "Show me what you would do with all ready changes.",
      "expected": true
    },
    {
      "id": "resume-established-loop",
      "prompt": "again",
      "expected": true
    },
    {
      "id": "near-miss-read-only-review",
      "prompt": "Review this PR and give me read-only feedback.",
      "expected": false
    },
    {
      "id": "near-miss-commit-message",
      "prompt": "Write a commit message for this diff.",
      "expected": false
    },
    {
      "id": "near-miss-deploy-only",
      "prompt": "Deploy production.",
      "expected": false
    },
    {
      "id": "near-miss-again-no-context",
      "prompt": "again",
      "expected": false
    },
    {
      "id": "near-miss-more-changes-first",
      "prompt": "More changes first.",
      "expected": false
    },
    {
      "id": "near-miss-generate-ui-surfaces",
      "prompt": "Generate three UI surface iterations for comparison.",
      "expected": false
    },
    {
      "id": "near-miss-non-git-sync",
      "prompt": "Sync the customer records to the CRM.",
      "expected": false
    },
    {
      "id": "queue-data-migration",
      "prompt": "Queue the database migration and ORM schema change.",
      "expected": true
    },
    {
      "id": "near-miss-release-notes-writing",
      "prompt": "Curate the public CLI release notes for this change.",
      "expected": false
    },
    {
      "id": "audit-complete-proposal-corpus",
      "prompt": "Audit every change proposal in every state for malformed escaped newlines.",
      "expected": true
    },
    {
      "id": "repair-complete-proposal-corpus",
      "prompt": "Fix all merge requests with malformed summaries.",
      "expected": true
    }
  ],
  "journeys": [
    {
      "id": "preview-multi-worktree",
      "prompt": "Show me what you would do with everything ready.",
      "mode": "preview",
      "authority": [],
      "expectedBehaviors": [
        "Capture two read-only inventories",
        "Emit a validated plan",
        "Create no Git or provider state"
      ]
    },
    {
      "id": "queue-single-unit",
      "prompt": "Put this up.",
      "mode": "queue",
      "authority": ["local-write", "proposal-write"],
      "expectedBehaviors": [
        "Package one coherent unit",
        "Verify it",
        "Open but do not merge a proposal"
      ]
    },
    {
      "id": "sync-clean-canonical-target",
      "prompt": "Sync with remote main.",
      "mode": "sync",
      "authority": ["remote-read", "local-fast-forward"],
      "expectedBehaviors": [
        "Resolve the exact canonical remote and target without guessing among remotes",
        "Fetch only that target and record its old and new revisions",
        "Fast-forward a clean behind-only local target",
        "Never push, prune, stash, reset, rebase, deploy, or mutate provider state",
        "Report original and resulting HEAD plus final ahead and behind counts"
      ]
    },
    {
      "id": "sync-dirty-feature-branch",
      "prompt": "Get us in line with main.",
      "mode": "sync",
      "authority": ["remote-read"],
      "expectedBehaviors": [
        "Capture dirty and in-progress state before contacting the remote",
        "Refresh the exact target without changing the checkout",
        "Preserve every local change without creating a cleanup stash",
        "Report fetch-only preservation rather than claiming the branch is synchronized"
      ]
    },
    {
      "id": "sync-clean-feature-branch",
      "prompt": "Pull the latest changes from origin.",
      "mode": "sync",
      "authority": ["remote-read", "local-write"],
      "expectedBehaviors": [
        "Preflight conflicts before changing the feature branch",
        "Use the established repository strategy or default to a normal local merge",
        "Require explicit or established safe authority before any rebase",
        "Never force-push rewritten or published history",
        "Run proportionate repository checks after integrating the target"
      ]
    },
    {
      "id": "queue-confirmed-completed-work",
      "prompt": "The implementation and checks are complete. Put this up.",
      "mode": "queue",
      "authority": ["local-write", "proposal-write"],
      "expectedBehaviors": [
        "Treat the user's signal as readiness confirmation",
        "Scope the handoff to the completed attributable work",
        "Preserve and report unrelated work"
      ]
    },
    {
      "id": "queue-versioned-ui-artifacts",
      "prompt": "Put these generated UI surface iterations up.",
      "mode": "queue",
      "authority": ["local-write", "proposal-write"],
      "expectedBehaviors": [
        "Use an existing repository artifact naming convention when present",
        "Otherwise apply the saved UI artifact naming fallback",
        "Do not alter source, package, deployment, or release versions"
      ]
    },
    {
      "id": "sweep-mixed-ready-work",
      "prompt": "Open focused changes for everything ready.",
      "mode": "sweep",
      "authority": ["local-write", "proposal-write"],
      "expectedBehaviors": [
        "Split by outcome and dependency",
        "Preserve paused and concurrent work"
      ]
    },
    {
      "id": "integrate-current-heads",
      "prompt": "Merge what's ready.",
      "mode": "integrate",
      "authority": ["local-write", "proposal-write", "merge"],
      "expectedBehaviors": [
        "Refresh required checks and discussions",
        "Require approval for the exact current revision"
      ]
    },
    {
      "id": "ship-authorized-work",
      "prompt": "Ship what's ready.",
      "mode": "ship",
      "authority": ["local-write", "proposal-write", "merge", "preview-deploy"],
      "expectedBehaviors": [
        "Summarize the ready scope and planned shipping path before consequential mutation without adding a redundant permission gate",
        "Integrate eligible proposals",
        "Require policy or current authority for production",
        "Track changes made during review against each original proposal head",
        "Verify immutable revision and canonical target",
        "Summarize what actually shipped, review-driven changes, re-verification, and preserved work"
      ]
    },
    {
      "id": "ship-expedited-emergency",
      "prompt": "Ship this fast and finish the changelog and cleanup immediately afterward.",
      "mode": "ship",
      "authority": [
        "local-write",
        "proposal-write",
        "merge",
        "production-deploy"
      ],
      "expectedBehaviors": [
        "Infer the run-only expedited level from urgency language",
        "Run focused checks and independent review before merge and deployment",
        "Record the first healthy deployment as live-unreconciled",
        "Complete forward release reconciliation, remaining verification, and cleanup",
        "Redeploy only when the final canonical runtime artifact differs"
      ]
    },
    {
      "id": "ship-break-glass-emergency",
      "prompt": "Users cannot log in. Deploy first and have independent review happen after deployment.",
      "mode": "ship",
      "authority": [
        "local-write",
        "proposal-write",
        "merge",
        "production-deploy"
      ],
      "expectedBehaviors": [
        "Treat explicit deploy-before-review language as run-only break-glass authority",
        "Record the previous production revision and rollback path",
        "Run focused checks and deploy one exact candidate before independent review",
        "Persist live-unreviewed until review completes",
        "Rollback or correct a rejected live candidate",
        "Reconcile Git and release state forward and conditionally establish the final canonical deployment"
      ]
    },
    {
      "id": "ship-break-glass-recommendation",
      "prompt": "This has been tested and needs to go live because customers are affected.",
      "mode": "ship",
      "authority": ["production-deploy"],
      "expectedBehaviors": [